{
  "$schema": "https://json-schema.org/draft/2020-12/schema",
  "type": "array",
  "items": {
    "type": "object",
    "required": ["id", "name"],
    "properties": {
      "id": { "type": "string", "minLength": 1 },
      "name": { "type": "string", "minLength": 1 },
      "increasedStat": {
        "type": ["string", "null"],
        "enum": [null, "HP", "ATTACK", "DEFENSE", "SPECIAL_ATTACK", "SPECIAL_DEFENSE", "SPEED"]
      },
      "decreasedStat": {
        "type": ["string", "null"],
        "enum": [null, "HP", "ATTACK", "DEFENSE", "SPECIAL_ATTACK", "SPECIAL_DEFENSE", "SPEED"]
      }
    }
  }
}
