[
  { "id": "hardy", "name": "Hardy", "increasedStat": null, "decreasedStat": null },
  { "id": "lonely", "name": "Lonely", "increasedStat": "ATTACK", "decreasedStat": "DEFENSE" },
  { "id": "brave", "name": "Brave", "increasedStat": "ATTACK", "decreasedStat": "SPEED" },
  { "id": "adamant", "name": "Adamant", "increasedStat": "ATTACK", "decreasedStat": "SPECIAL_ATTACK" },
  { "id": "naughty", "name": "Naughty", "increasedStat": "ATTACK", "decreasedStat": "SPECIAL_DEFENSE" },
  { "id": "bold", "name": "Bold", "increasedStat": "DEFENSE", "decreasedStat": "ATTACK" },
  { "id": "docile", "name": "Docile", "increasedStat": null, "decreasedStat": null },
  { "id": "relaxed", "name": "Relaxed", "increasedStat": "DEFENSE", "decreasedStat": "SPEED" },
  { "id": "impish", "name": "Impish", "increasedStat": "DEFENSE", "decreasedStat": "SPECIAL_ATTACK" },
  { "id": "lax", "name": "Lax", "increasedStat": "DEFENSE", "decreasedStat": "SPECIAL_DEFENSE" },
  { "id": "timid", "name": "Timid", "increasedStat": "SPEED", "decreasedStat": "ATTACK" },
  { "id": "hasty", "name": "Hasty", "increasedStat": "SPEED", "decreasedStat": "DEFENSE" },
  { "id": "serious", "name": "Serious", "increasedStat": null, "decreasedStat": null },
  { "id": "jolly", "name": "Jolly", "increasedStat": "SPEED", "decreasedStat": "SPECIAL_ATTACK" },
  { "id": "naive", "name": "Naive", "increasedStat": "SPEED", "decreasedStat": "SPECIAL_DEFENSE" },
  { "id": "modest", "name": "Modest", "increasedStat": "SPECIAL_ATTACK", "decreasedStat": "ATTACK" },
  { "id": "mild", "name": "Mild", "increasedStat": "SPECIAL_ATTACK", "decreasedStat": "DEFENSE" },
  { "id": "quiet", "name": "Quiet", "increasedStat": "SPECIAL_ATTACK", "decreasedStat": "SPEED" },
  { "id": "bashful", "name": "Bashful", "increasedStat": null, "decreasedStat": null },
  { "id": "rash", "name": "Rash", "increasedStat": "SPECIAL_ATTACK", "decreasedStat": "SPECIAL_DEFENSE" },
  { "id": "calm", "name": "Calm", "increasedStat": "SPECIAL_DEFENSE", "decreasedStat": "ATTACK" },
  { "id": "gentle", "name": "Gentle", "increasedStat": "SPECIAL_DEFENSE", "decreasedStat": "DEFENSE" },
  { "id": "sassy", "name": "Sassy", "increasedStat": "SPECIAL_DEFENSE", "decreasedStat": "SPEED" },
  { "id": "careful", "name": "Careful", "increasedStat": "SPECIAL_DEFENSE", "decreasedStat": "SPECIAL_ATTACK" },
  { "id": "quirky", "name": "Quirky", "increasedStat": null, "decreasedStat": null }
]
